{
  "$schema": "./production_mutation_registry.schema.json",
  "schema_version": "1.0",
  "registry_kind": "hermes-production-mutation-registry",
  "unknown_path_policy": {
    "default": "fail-closed",
    "rule": "A production mutation is unsupported unless its actor, target resource, lock or transaction boundary, and rollback surface are present in this registry. Callers must reject an unknown path before it writes.",
    "enforcement_status": "This inventory is authoritative now; runtime admission enforcement is intentionally deferred to the bounded follow-on tasks below.",
    "follow_on_hook_points": [
      {
        "task": "86e2kmucr",
        "hook": "production mutation admission check at governed installer and deploy entry points",
        "purpose": "Reject a requested resource mutation that has no registry actor/resource mapping."
      },
      {
        "task": "86e2kmuct",
        "hook": "shared executor-dispatch lease admission",
        "purpose": "Enforce the one logical executor dispatch surface named by this registry."
      }
    ]
  },
  "resources": [
    {
      "id": "fleet-config",
      "path": "~/.hermes/config.yaml and ~/.hermes/profiles/*",
      "description": "Fleet overlay and managed profile configuration.",
      "concurrency_model": "single installer transaction with pre-write snapshots"
    },
    {
      "id": "cron-jobs",
      "path": "~/.hermes/cron/jobs.json and ~/.hermes/cron/.jobs.lock",
      "description": "Cron definitions and scheduler lifecycle metadata.",
      "concurrency_model": "atomic replacement plus the cron jobs advisory lock"
    },
    {
      "id": "skills-policy",
      "path": "~/.hermes/skills/, ~/.hermes/profiles/*/skills/, and ~/.hermes/state/skill-pulls/",
      "description": "Curated skill trees, suppression policy, and skill-pull evidence.",
      "concurrency_model": "installer transaction or named skill-pull/catalog locks"
    },
    {
      "id": "runtime-release",
      "path": "~/.hermes/releases/ and ~/.hermes/runtime-current",
      "description": "Immutable release directories, current-release pointer, cut receipts, and prior-release pointer.",
      "concurrency_model": "single mini release-cut directory lock and atomic symlink swap"
    },
    {
      "id": "governed-mini-scripts",
      "path": "~/.hermes/scripts/ and ~/Library/LaunchAgents/",
      "description": "Hash-pinned operational scripts, wrappers, and launchd configuration installed by the release cut.",
      "concurrency_model": "release-cut serialization with per-file hash verification"
    },
    {
      "id": "executor-admission",
      "path": "~/.hermes/state/executor-admission.sqlite3",
      "description": "Fenced lease and pending-wake state shared by both executor cron jobs.",
      "concurrency_model": "SQLite BEGIN IMMEDIATE transaction with fencing token"
    },
    {
      "id": "session-db",
      "path": "~/.hermes/state.db (including WAL sidecars)",
      "description": "Hermes sessions and dashboard-visible conversation state.",
      "concurrency_model": "SQLite WAL multi-writer tolerant; lifecycle contract follows task 86e2kmud2"
    },
    {
      "id": "kanban-dispatcher",
      "path": "~/.hermes/kanban/kanban/.dispatcher.lock and board databases",
      "description": "Gateway-owned Kanban dispatch and board state.",
      "concurrency_model": "machine-global advisory dispatcher lock plus SQLite transactions"
    },
    {
      "id": "clickup-remote-state",
      "path": "ClickUp tasks, comments, statuses, and dependency records",
      "description": "Remote task lifecycle state changed by governed executor, validator, and lifecycle jobs.",
      "concurrency_model": "ClickUp API conditional workflow and task-level evidence contract"
    },
    {
      "id": "repo-worktrees",
      "path": "/Users/colingreig/dev/* worktrees and governed branch refs",
      "description": "Repository worktrees and cleanup targets used by executor and maintenance jobs.",
      "concurrency_model": "per-repository worktree/claim controls; scripts own their deletion safety checks"
    },
    {
      "id": "clickup-workspace-cache",
      "path": "~/.hermes/state/clickup-map.json, ~/.hermes/state/clickup-workspace-map.md, and ~/brain/clickup-workspace-map.md",
      "description": "Refreshed ClickUp topology cache and canonical human-readable workspace note.",
      "concurrency_model": "script-local atomic replacement and refresh lock"
    },
    {
      "id": "pr-pipeline-state",
      "path": "~/.hermes/state/ci-health-*.json and ~/.hermes/scripts/pr_pipeline/* state",
      "description": "PR pipeline health, review-poll, and validation state used by no-agent watchdogs.",
      "concurrency_model": "script-local atomic state files and pipeline-specific locks"
    },
    {
      "id": "claim-ledger",
      "path": "~/.hermes/state/claim* and executor claim records",
      "description": "Stranded task claim and lease records reconciled by the claim reaper.",
      "concurrency_model": "claim-store transactional ownership rules"
    },
    {
      "id": "email-delivery",
      "path": "Postmark delivery to colin@colingreig.com",
      "description": "The explicit fleet health digest delivery side effect.",
      "concurrency_model": "one cron invocation; Postmark sender owns delivery retry and receipts"
    },
    {
      "id": "purelymail-poller-deploy",
      "path": "~/.hermes/deploy/purelymail-poller/ and ~/.hermes/deploy/purelymail-poller/.lock",
      "description": "External ignite-email-infra deployment target and deployment lease.",
      "concurrency_model": "external deployer-held named lock"
    }
  ],
  "actors": [
    {
      "id": "fleet-config-installer",
      "name": "Fleet configuration installer",
      "actor_class": "conductor-ssh",
      "owning_repository": "hermes-agent",
      "mutability": "mutating",
      "entry_points": ["machine-setup/fleet-config/install_fleet_config.py"],
      "resources_touched": ["fleet-config", "cron-jobs", "skills-policy"],
      "current_lock_or_transaction_boundary": {
        "kind": "exclusive no-follow file lock and install transaction",
        "path_or_identity": "~/.hermes/.fleet-config-install.lock",
        "behavior": "Verifies sources, snapshots every destination, writes atomically, and restores snapshots on failure."
      },
      "rollback_surface": {
        "surface": "~/.hermes/logs/fleet-config-installs/<receipt>/destinations",
        "procedure": "Installer rollback restores planned snapshots; operator may inspect the receipt before a targeted recovery."
      },
      "operational_pointers": {
        "activation": {
          "entry_point": "machine-setup/fleet-config/install_fleet_config.py",
          "command": "python3 install_fleet_config.py --home <home>"
        },
        "rollback": {
          "entry_point": "machine-setup/fleet-config/install_fleet_config.py::_rollback",
          "command": "automatic snapshot rollback on an install failure; inspect its receipt before targeted recovery"
        },
        "verification": {
          "entry_point": "machine-setup/mini-scripts/verify_governed_paths.py",
          "command": "python3 verify_governed_paths.py --home <home>"
        }
      }
    },
    {
      "id": "mini-release-cut",
      "name": "Hermes Mini release cut",
      "actor_class": "conductor-ssh",
      "owning_repository": "hermes-agent",
      "mutability": "mutating",
      "entry_points": ["scripts/mini-release-cut.sh"],
      "resources_touched": ["runtime-release", "governed-mini-scripts"],
      "current_lock_or_transaction_boundary": {
        "kind": "directory lease and atomic release pointer swap",
        "path_or_identity": "~/.hermes/releases/.mini-release-cut.lock",
        "behavior": "Builds and validates a fresh release before atomically repointing runtime-current; serializes cuts, rollback, and prune."
      },
      "rollback_surface": {
        "surface": "~/.hermes/releases/.previous and .mini-release-last-receipt.json",
        "procedure": "mini-release-cut.sh --rollback repoints runtime-current to the verified previous release and restarts services."
      },
      "operational_pointers": {
        "activation": {
          "entry_point": "scripts/mini-release-cut.sh",
          "command": "mini-release-cut.sh --ref <sha-or-ref> --certified-sha <full-sha> --promotion-receipt-id <sha256>"
        },
        "rollback": {
          "entry_point": "scripts/mini-release-cut.sh",
          "command": "mini-release-cut.sh --rollback"
        },
        "verification": {
          "entry_point": "machine-setup/mini-scripts/verify_governed_paths.py",
          "command": "python3 verify_governed_paths.py --home <home>"
        }
      }
    },
    {
      "id": "fleet-outcomes-reconciler",
      "name": "Fleet outcomes reconciler",
      "actor_class": "conductor-ssh",
      "owning_repository": "hermes-agent",
      "mutability": "mutating",
      "entry_points": ["machine-setup/mini-scripts/reconcile_fleet_outcomes.py"],
      "resources_touched": ["governed-mini-scripts", "cron-jobs"],
      "current_lock_or_transaction_boundary": {
        "kind": "snapshot-backed reconciliation under the cron jobs advisory lock",
        "path_or_identity": "~/.hermes/releases/fleet-outcomes and ~/.hermes/cron/.jobs.lock",
        "behavior": "Hash-verifies every declared source, atomically replaces only manifest targets, and restores the recorded snapshot if verification fails."
      },
      "rollback_surface": {
        "surface": "~/.hermes/releases/fleet-outcomes/previous and snapshots/<sha256>.json",
        "procedure": "reconcile_fleet_outcomes.py rollback restores the exact prior scripts, LaunchAgents, and cron document from its content-addressed snapshot."
      },
      "operational_pointers": {
        "activation": {
          "entry_point": "machine-setup/mini-scripts/reconcile_fleet_outcomes.py",